{
  "season": 2026,
  "updated_utc": "2026-10-15T23:22:27Z",
  "sims": 10000,
  "estimate": true,
  "source": "elo_prior + adopted game_params \u2014 OUR MODEL ONLY (no market input)",
  "method": "Monte Carlo, seed 20260901: regular season sampled from schedule_full.json probs (adopted params); playoffs from Elo (hfa 45.0, SB neutral); 7 seeds/conf.",
  "notes": [
    "Tiebreakers SIMPLIFIED: head-to-head pct, division record, conference record, then a deterministic RNG pick. Real NFL tiebreakers run deeper (common games, strength of victory, ...) \u2014 these odds are estimates.",
    "Deterministic: fixed RNG seed; output changes only when the model does."
  ],
  "teams": {
    "ARI": {
      "playoff": 0.039,
      "division": 0.0035,
      "conference": 0.0005,
      "champion": 0.0
    },
    "ATL": {
      "playoff": 0.4011,
      "division": 0.325,
      "conference": 0.024,
      "champion": 0.0091
    },
    "BAL": {
      "playoff": 0.6704,
      "division": 0.3944,
      "conference": 0.0878,
      "champion": 0.0404
    },
    "BUF": {
      "playoff": 0.8101,
      "division": 0.5387,
      "conference": 0.1727,
      "champion": 0.0896
    },
    "CAR": {
      "playoff": 0.4726,
      "division": 0.4002,
      "conference": 0.0306,
      "champion": 0.011
    },
    "CHI": {
      "playoff": 0.4232,
      "division": 0.1515,
      "conference": 0.0371,
      "champion": 0.0166
    },
    "CIN": {
      "playoff": 0.519,
      "division": 0.2467,
      "conference": 0.0415,
      "champion": 0.0166
    },
    "CLE": {
      "playoff": 0.2794,
      "division": 0.1021,
      "conference": 0.0105,
      "champion": 0.003
    },
    "DAL": {
      "playoff": 0.2693,
      "division": 0.197,
      "conference": 0.0089,
      "champion": 0.0031
    },
    "DEN": {
      "playoff": 0.6857,
      "division": 0.4817,
      "conference": 0.1042,
      "champion": 0.0516
    },
    "DET": {
      "playoff": 0.5231,
      "division": 0.1987,
      "conference": 0.049,
      "champion": 0.0199
    },
    "GB": {
      "playoff": 0.3837,
      "division": 0.1225,
      "conference": 0.0261,
      "champion": 0.0112
    },
    "HOU": {
      "playoff": 0.4794,
      "division": 0.1615,
      "conference": 0.0346,
      "champion": 0.0125
    },
    "IND": {
      "playoff": 0.2942,
      "division": 0.0792,
      "conference": 0.013,
      "champion": 0.0049
    },
    "JAX": {
      "playoff": 0.9154,
      "division": 0.7562,
      "conference": 0.2653,
      "champion": 0.143
    },
    "KC": {
      "playoff": 0.6164,
      "division": 0.3939,
      "conference": 0.072,
      "champion": 0.0322
    },
    "LAC": {
      "playoff": 0.0811,
      "division": 0.0325,
      "conference": 0.0018,
      "champion": 0.0001
    },
    "LAR": {
      "playoff": 0.5551,
      "division": 0.1165,
      "conference": 0.0604,
      "champion": 0.0268
    },
    "LV": {
      "playoff": 0.2126,
      "division": 0.0919,
      "conference": 0.0058,
      "champion": 0.0024
    },
    "MIA": {
      "playoff": 0.0253,
      "division": 0.0058,
      "conference": 0.0002,
      "champion": 0.0
    },
    "MIN": {
      "playoff": 0.8043,
      "division": 0.5273,
      "conference": 0.182,
      "champion": 0.0981
    },
    "NE": {
      "playoff": 0.7453,
      "division": 0.4276,
      "conference": 0.1419,
      "champion": 0.0679
    },
    "NO": {
      "playoff": 0.1769,
      "division": 0.1315,
      "conference": 0.0036,
      "champion": 0.001
    },
    "NYG": {
      "playoff": 0.445,
      "division": 0.3584,
      "conference": 0.029,
      "champion": 0.0104
    },
    "NYJ": {
      "playoff": 0.1071,
      "division": 0.0279,
      "conference": 0.0013,
      "champion": 0.0004
    },
    "PHI": {
      "playoff": 0.4623,
      "division": 0.3724,
      "conference": 0.0297,
      "champion": 0.01
    },
    "PIT": {
      "playoff": 0.5437,
      "division": 0.2568,
      "conference": 0.0474,
      "champion": 0.0181
    },
    "SEA": {
      "playoff": 0.8303,
      "division": 0.3294,
      "conference": 0.1922,
      "champion": 0.1059
    },
    "SF": {
      "playoff": 0.9227,
      "division": 0.5506,
      "conference": 0.3196,
      "champion": 0.1926
    },
    "TB": {
      "playoff": 0.1901,
      "division": 0.1433,
      "conference": 0.0052,
      "champion": 0.0012
    },
    "TEN": {
      "playoff": 0.0149,
      "division": 0.0031,
      "conference": 0.0,
      "champion": 0.0
    },
    "WAS": {
      "playoff": 0.1013,
      "division": 0.0722,
      "conference": 0.0021,
      "champion": 0.0004
    }
  }
}
